{
  "schema_version": "position-snapshot.v0",
  "spec_date": "2026-04",
  "snapshot_id": "snap_fixture_linear",
  "as_of": "2026-04-24T10:00:00Z",
  "published_at": "2026-04-24T10:00:01Z",
  "publisher": {"entity_id": "fixture-publisher", "entity_type": "service"},
  "group_context": {"group_id": "fixture-group", "snapshot_scope": "network", "valuation_ccy": "USD"},
  "provenance": {"collector": {"id": "pft-positions-fixtures", "version": "0.1.0"}, "sources": [{"source_type": "manual", "source_id": "fixture:linear", "fetched_at": "2026-04-24T10:00:00Z"}], "content_hash": "447dc45eeb09859574f359c8ecea66e5fc5956ac2d6a3fe1057e628a9f6b57ba"},
  "normalization": {"numeric_encoding": "decimal-string", "timestamp_encoding": "rfc3339-utc", "pnl_sign_convention": "profit-positive", "quantity_sign_convention": "side-and-positive-quantity"},
  "positions": [{"position_id": "fixture-btc-perp", "instrument_type": "linear", "asset_class": "crypto", "venue": {"venue_id": "binance", "venue_type": "cex"}, "account_ref": "acct:fixture:linear", "ccxt": {"exchange_id": "binance", "market_symbol": "BTC/USDT:USDT"}, "side": "long", "quantity": "1.00", "unit": "BTC", "valuation_ccy": "USD", "mark_price": "70000.00", "notional_value": "70000.00", "cost_basis": "65000.00", "pnl_unrealized": "5000.00", "pnl_realized": "0.00", "risk": {"liquidation_price": "50000.00", "value_at_risk_1d": "3500.00"}, "linear": {"symbol": "BTCUSDT", "contract_kind": "perpetual", "entry_price": "65000.00", "leverage": "2"}}]
}
